{
  "version": 1,
  "name": "Colorful Light",
  "author": "PowerToys",
  "description": "The accent-tinted colorful theme in a bright, airy variant",
  "fonts": {
    "primary": { "family": "Segoe UI Variable", "size": 14, "weight": "Normal" },
    "monospace": { "family": "Cascadia Code", "size": 13, "weight": "Normal" },
    "title": { "family": "Segoe UI Variable", "size": 16, "weight": "SemiBold" },
    "caption": { "family": "Segoe UI Variable", "size": 12, "weight": "Normal" }
  },
  "resources": {
    "dark": {
      "LayerOnAcrylicPrimaryBackgroundBrush": "#80003062",
      "LayerOnAcrylicSecondaryBackgroundBrush": "Transparent",
      "CmdPal.CommandBarBorderBrush": "#1AFFFFFF",
      "CmdPal.TopBarBorderBrush": "#14FFFFFF",
      "CmdPal.DividerStrokeColorDefaultBrush": "#1AFFFFFF",
      "CmdPal.SearchBoxBackground": "#20FFFFFF",
      "CmdPal.SearchBoxForeground": "#FFFFFF",
      "CmdPal.SearchBoxPlaceholderForeground": "#8AFFFFFF",
      "CmdPal.SearchBoxBorderBrush": "#1AFFFFFF",
      "CmdPal.ListItemBackground": "Transparent",
      "CmdPal.ListItemBackgroundPointerOver": "#14FFFFFF",
      "CmdPal.ListItemBackgroundSelected": "#20FFFFFF",
      "CmdPal.ListItemForeground": "#FFFFFF",
      "CmdPal.ListItemForegroundSecondary": "#B3FFFFFF",
      "CmdPal.ButtonBackground": "#20FFFFFF",
      "CmdPal.ButtonForeground": "#FFFFFF",
      "CmdPal.ButtonBackgroundPointerOver": "#30FFFFFF",
      "CmdPal.ButtonBorderBrush": "#1AFFFFFF",
      "CmdPal.AccentColor": "#60CDFF",
      "CmdPal.TagBackground": "#20FFFFFF",
      "CmdPal.TagForeground": "#60CDFF",
      "CmdPal.TagBorderBrush": "#1AFFFFFF",
      "CmdPal.ContextMenuBackground": "#002050",
      "CmdPal.ContextMenuBorderBrush": "#1AFFFFFF",
      "CmdPal.ContextMenuItemBackgroundPointerOver": "#14FFFFFF",
      "CmdPal.ContextMenuForeground": "#FFFFFF",
      "Dock.ItemBackground": "Transparent",
      "Dock.ItemBackgroundPointerOver": "#14FFFFFF",
      "Dock.ItemBackgroundPressed": "#0BFFFFFF",
      "Dock.ItemBorderBrush": "Transparent",
      "Dock.ItemBorderBrushPointerOver": "#1AFFFFFF",
      "Dock.ItemForeground": "#FFFFFF",
      "Dock.ItemForegroundSecondary": "#B3FFFFFF"
    },
    "light": {
      "LayerOnAcrylicPrimaryBackgroundBrush": "#A0B0D4FF",
      "LayerOnAcrylicSecondaryBackgroundBrush": "#66C0DDFF",
      "CmdPal.CommandBarBorderBrush": "#20000000",
      "CmdPal.TopBarBorderBrush": "#14000000",
      "CmdPal.DividerStrokeColorDefaultBrush": "#20000000",
      "CmdPal.SearchBoxBackground": "#40FFFFFF",
      "CmdPal.SearchBoxForeground": "#1B1B1B",
      "CmdPal.SearchBoxPlaceholderForeground": "#72000000",
      "CmdPal.SearchBoxBorderBrush": "#20000000",
      "CmdPal.ListItemBackground": "Transparent",
      "CmdPal.ListItemBackgroundPointerOver": "#20FFFFFF",
      "CmdPal.ListItemBackgroundSelected": "#40FFFFFF",
      "CmdPal.ListItemForeground": "#1B1B1B",
      "CmdPal.ListItemForegroundSecondary": "#72000000",
      "CmdPal.ButtonBackground": "#40FFFFFF",
      "CmdPal.ButtonForeground": "#1B1B1B",
      "CmdPal.ButtonBackgroundPointerOver": "#60FFFFFF",
      "CmdPal.ButtonBorderBrush": "#20000000",
      "CmdPal.AccentColor": "#005FB8",
      "CmdPal.TagBackground": "#40FFFFFF",
      "CmdPal.TagForeground": "#005FB8",
      "CmdPal.TagBorderBrush": "#20000000",
      "CmdPal.ContextMenuBackground": "#E0EEFF",
      "CmdPal.ContextMenuBorderBrush": "#20000000",
      "CmdPal.ContextMenuItemBackgroundPointerOver": "#30FFFFFF",
      "CmdPal.ContextMenuForeground": "#1B1B1B",
      "Dock.ItemBackground": "Transparent",
      "Dock.ItemBackgroundPointerOver": "#30FFFFFF",
      "Dock.ItemBackgroundPressed": "#20FFFFFF",
      "Dock.ItemBorderBrush": "Transparent",
      "Dock.ItemBorderBrushPointerOver": "#20000000",
      "Dock.ItemForeground": "#1B1B1B",
      "Dock.ItemForegroundSecondary": "#72000000"
    }
  },
  "backdrop": {
    "style": "Acrylic",
    "tintOpacity": 0.7,
    "luminosityOpacity": 0.75
  }
}
