{
  "version": 1,
  "name": "Nord",
  "author": "PowerToys",
  "description": "Inspired by the Arctic, north-bluish color palette",
  "fonts": {
    "primary": { "family": "Segoe UI", "size": 13, "weight": "Normal" },
    "monospace": { "family": "Cascadia Mono", "size": 12, "weight": "Normal" },
    "title": { "family": "Segoe UI", "size": 15, "weight": "Bold" },
    "caption": { "family": "Segoe UI", "size": 11, "weight": "Normal" }
  },
  "resources": {
    "dark": {
      "LayerOnAcrylicPrimaryBackgroundBrush": "#802E3440",
      "LayerOnAcrylicSecondaryBackgroundBrush": "Transparent",
      "CmdPal.CommandBarBorderBrush": "#3B4252",
      "CmdPal.TopBarBorderBrush": "#3B4252",
      "CmdPal.DividerStrokeColorDefaultBrush": "#434C5E",
      "CmdPal.SearchBoxBackground": "#3B4252",
      "CmdPal.SearchBoxForeground": "#ECEFF4",
      "CmdPal.SearchBoxPlaceholderForeground": "#D8DEE9",
      "CmdPal.SearchBoxBorderBrush": "#434C5E",
      "CmdPal.ListItemBackground": "Transparent",
      "CmdPal.ListItemBackgroundPointerOver": "#303B4252",
      "CmdPal.ListItemBackgroundSelected": "#50434C5E",
      "CmdPal.ListItemForeground": "#ECEFF4",
      "CmdPal.ListItemForegroundSecondary": "#D8DEE9",
      "CmdPal.ButtonBackground": "#3B4252",
      "CmdPal.ButtonForeground": "#ECEFF4",
      "CmdPal.ButtonBackgroundPointerOver": "#434C5E",
      "CmdPal.ButtonBorderBrush": "#434C5E",
      "CmdPal.AccentColor": "#88C0D0",
      "CmdPal.TagBackground": "#3B4252",
      "CmdPal.TagForeground": "#8FBCBB",
      "CmdPal.TagBorderBrush": "#434C5E",
      "CmdPal.ContextMenuBackground": "#2E3440",
      "CmdPal.ContextMenuBorderBrush": "#3B4252",
      "CmdPal.ContextMenuItemBackgroundPointerOver": "#3B4252",
      "CmdPal.ContextMenuForeground": "#ECEFF4",
      "Dock.ItemBackground": "Transparent",
      "Dock.ItemBackgroundPointerOver": "#303B4252",
      "Dock.ItemBackgroundPressed": "#203B4252",
      "Dock.ItemBorderBrush": "Transparent",
      "Dock.ItemBorderBrushPointerOver": "#434C5E",
      "Dock.ItemForeground": "#ECEFF4",
      "Dock.ItemForegroundSecondary": "#D8DEE9"
    },
    "light": {
      "LayerOnAcrylicPrimaryBackgroundBrush": "#A0ECEFF4",
      "LayerOnAcrylicSecondaryBackgroundBrush": "#66E5E9F0",
      "CmdPal.CommandBarBorderBrush": "#D8DEE9",
      "CmdPal.TopBarBorderBrush": "#D8DEE9",
      "CmdPal.DividerStrokeColorDefaultBrush": "#D8DEE9",
      "CmdPal.SearchBoxBackground": "#ECEFF4",
      "CmdPal.SearchBoxForeground": "#2E3440",
      "CmdPal.SearchBoxPlaceholderForeground": "#4C566A",
      "CmdPal.SearchBoxBorderBrush": "#D8DEE9",
      "CmdPal.ListItemBackground": "Transparent",
      "CmdPal.ListItemBackgroundPointerOver": "#10434C5E",
      "CmdPal.ListItemBackgroundSelected": "#20434C5E",
      "CmdPal.ListItemForeground": "#2E3440",
      "CmdPal.ListItemForegroundSecondary": "#4C566A",
      "CmdPal.ButtonBackground": "#E5E9F0",
      "CmdPal.ButtonForeground": "#2E3440",
      "CmdPal.ButtonBackgroundPointerOver": "#D8DEE9",
      "CmdPal.ButtonBorderBrush": "#D8DEE9",
      "CmdPal.AccentColor": "#5E81AC",
      "CmdPal.TagBackground": "#E5E9F0",
      "CmdPal.TagForeground": "#5E81AC",
      "CmdPal.TagBorderBrush": "#D8DEE9",
      "CmdPal.ContextMenuBackground": "#ECEFF4",
      "CmdPal.ContextMenuBorderBrush": "#D8DEE9",
      "CmdPal.ContextMenuItemBackgroundPointerOver": "#E5E9F0",
      "CmdPal.ContextMenuForeground": "#2E3440",
      "Dock.ItemBackground": "Transparent",
      "Dock.ItemBackgroundPointerOver": "#10434C5E",
      "Dock.ItemBackgroundPressed": "#08434C5E",
      "Dock.ItemBorderBrush": "Transparent",
      "Dock.ItemBorderBrushPointerOver": "#D8DEE9",
      "Dock.ItemForeground": "#2E3440",
      "Dock.ItemForegroundSecondary": "#4C566A"
    }
  },
  "backdrop": {
    "style": "Acrylic",
    "tintOpacity": 0.88,
    "luminosityOpacity": 0.9
  }
}
