{
  "version": 1,
  "name": "Default Dark",
  "author": "PowerToys",
  "description": "The default dark theme matching CmdPal's standard appearance",
  "fonts": {
    "primary": { "family": "Segoe UI Variable", "size": 14, "weight": "Normal" },
    "monospace": { "family": "Cascadia Code", "size": 13, "weight": "Normal" },
    "title": { "family": "Segoe UI Variable", "size": 16, "weight": "SemiBold" },
    "caption": { "family": "Segoe UI Variable", "size": 12, "weight": "Normal" }
  },
  "resources": {
    "dark": {
      "LayerOnAcrylicPrimaryBackgroundBrush": "#50202020",
      "LayerOnAcrylicSecondaryBackgroundBrush": "Transparent",
      "CmdPal.CommandBarBorderBrush": "#1AFFFFFF",
      "CmdPal.TopBarBorderBrush": "#14FFFFFF",
      "CmdPal.DividerStrokeColorDefaultBrush": "#14FFFFFF",
      "CmdPal.SearchBoxBackground": "#0DFFFFFF",
      "CmdPal.SearchBoxForeground": "#FFFFFF",
      "CmdPal.SearchBoxPlaceholderForeground": "#8AFFFFFF",
      "CmdPal.SearchBoxBorderBrush": "#14FFFFFF",
      "CmdPal.ListItemBackground": "Transparent",
      "CmdPal.ListItemBackgroundPointerOver": "#0FFFFFFF",
      "CmdPal.ListItemBackgroundSelected": "#1AFFFFFF",
      "CmdPal.ListItemForeground": "#FFFFFF",
      "CmdPal.ListItemForegroundSecondary": "#8AFFFFFF",
      "CmdPal.ButtonBackground": "#0DFFFFFF",
      "CmdPal.ButtonForeground": "#FFFFFF",
      "CmdPal.ButtonBackgroundPointerOver": "#14FFFFFF",
      "CmdPal.ButtonBorderBrush": "#14FFFFFF",
      "CmdPal.AccentColor": "#60CDFF",
      "CmdPal.TagBackground": "#0DFFFFFF",
      "CmdPal.TagForeground": "#8AFFFFFF",
      "CmdPal.TagBorderBrush": "#14FFFFFF",
      "CmdPal.ContextMenuBackground": "#2D2D2D",
      "CmdPal.ContextMenuBorderBrush": "#1AFFFFFF",
      "CmdPal.ContextMenuItemBackgroundPointerOver": "#0FFFFFFF",
      "CmdPal.ContextMenuForeground": "#FFFFFF",
      "Dock.ItemBackground": "Transparent",
      "Dock.ItemBackgroundPointerOver": "#0FFFFFFF",
      "Dock.ItemBackgroundPressed": "#0BFFFFFF",
      "Dock.ItemBorderBrush": "Transparent",
      "Dock.ItemBorderBrushPointerOver": "#1AFFFFFF",
      "Dock.ItemForeground": "#FFFFFF",
      "Dock.ItemForegroundSecondary": "#8AFFFFFF"
    },
    "light": {
      "LayerOnAcrylicPrimaryBackgroundBrush": "#A0FFFFFF",
      "LayerOnAcrylicSecondaryBackgroundBrush": "#66FFFFFF",
      "CmdPal.CommandBarBorderBrush": "#0F000000",
      "CmdPal.TopBarBorderBrush": "#0A000000",
      "CmdPal.DividerStrokeColorDefaultBrush": "#0A000000",
      "CmdPal.SearchBoxBackground": "#06000000",
      "CmdPal.SearchBoxForeground": "#1B1B1B",
      "CmdPal.SearchBoxPlaceholderForeground": "#72000000",
      "CmdPal.SearchBoxBorderBrush": "#0F000000",
      "CmdPal.ListItemBackground": "Transparent",
      "CmdPal.ListItemBackgroundPointerOver": "#06000000",
      "CmdPal.ListItemBackgroundSelected": "#0F000000",
      "CmdPal.ListItemForeground": "#1B1B1B",
      "CmdPal.ListItemForegroundSecondary": "#72000000",
      "CmdPal.ButtonBackground": "#06000000",
      "CmdPal.ButtonForeground": "#1B1B1B",
      "CmdPal.ButtonBackgroundPointerOver": "#0F000000",
      "CmdPal.ButtonBorderBrush": "#0F000000",
      "CmdPal.AccentColor": "#005FB8",
      "CmdPal.TagBackground": "#06000000",
      "CmdPal.TagForeground": "#5D000000",
      "CmdPal.TagBorderBrush": "#0F000000",
      "CmdPal.ContextMenuBackground": "#F9F9F9",
      "CmdPal.ContextMenuBorderBrush": "#0F000000",
      "CmdPal.ContextMenuItemBackgroundPointerOver": "#06000000",
      "CmdPal.ContextMenuForeground": "#1B1B1B",
      "Dock.ItemBackground": "Transparent",
      "Dock.ItemBackgroundPointerOver": "#80FFFFFF",
      "Dock.ItemBackgroundPressed": "#4DFFFFFF",
      "Dock.ItemBorderBrush": "Transparent",
      "Dock.ItemBorderBrushPointerOver": "#0F000000",
      "Dock.ItemForeground": "#1B1B1B",
      "Dock.ItemForegroundSecondary": "#72000000"
    }
  },
  "backdrop": {
    "style": "Acrylic",
    "tintOpacity": 0.85,
    "luminosityOpacity": 0.9
  }
}
