{
  "version": 1,
  "name": "Catppuccin Mocha",
  "author": "PowerToys",
  "description": "Warm, pastel dark theme based on the Catppuccin Mocha palette",
  "fonts": {
    "primary": { "family": "Inter", "size": 14, "weight": "Normal" },
    "monospace": { "family": "JetBrains Mono", "size": 13, "weight": "Normal" },
    "title": { "family": "Inter", "size": 17, "weight": "SemiBold" },
    "caption": { "family": "Inter", "size": 12, "weight": "Light" }
  },
  "resources": {
    "dark": {
      "LayerOnAcrylicPrimaryBackgroundBrush": "#801E1E2E",
      "LayerOnAcrylicSecondaryBackgroundBrush": "Transparent",
      "CmdPal.CommandBarBorderBrush": "#313244",
      "CmdPal.TopBarBorderBrush": "#313244",
      "CmdPal.DividerStrokeColorDefaultBrush": "#45475A",
      "CmdPal.SearchBoxBackground": "#313244",
      "CmdPal.SearchBoxForeground": "#CDD6F4",
      "CmdPal.SearchBoxPlaceholderForeground": "#A6ADC8",
      "CmdPal.SearchBoxBorderBrush": "#45475A",
      "CmdPal.ListItemBackground": "Transparent",
      "CmdPal.ListItemBackgroundPointerOver": "#30313244",
      "CmdPal.ListItemBackgroundSelected": "#50313244",
      "CmdPal.ListItemForeground": "#CDD6F4",
      "CmdPal.ListItemForegroundSecondary": "#A6ADC8",
      "CmdPal.ButtonBackground": "#313244",
      "CmdPal.ButtonForeground": "#CDD6F4",
      "CmdPal.ButtonBackgroundPointerOver": "#45475A",
      "CmdPal.ButtonBorderBrush": "#45475A",
      "CmdPal.AccentColor": "#CBA6F7",
      "CmdPal.TagBackground": "#313244",
      "CmdPal.TagForeground": "#F5C2E7",
      "CmdPal.TagBorderBrush": "#45475A",
      "CmdPal.ContextMenuBackground": "#1E1E2E",
      "CmdPal.ContextMenuBorderBrush": "#313244",
      "CmdPal.ContextMenuItemBackgroundPointerOver": "#313244",
      "CmdPal.ContextMenuForeground": "#CDD6F4",
      "Dock.ItemBackground": "Transparent",
      "Dock.ItemBackgroundPointerOver": "#30313244",
      "Dock.ItemBackgroundPressed": "#20313244",
      "Dock.ItemBorderBrush": "Transparent",
      "Dock.ItemBorderBrushPointerOver": "#45475A",
      "Dock.ItemForeground": "#CDD6F4",
      "Dock.ItemForegroundSecondary": "#A6ADC8"
    },
    "light": {
      "LayerOnAcrylicPrimaryBackgroundBrush": "#A0EFF1F5",
      "LayerOnAcrylicSecondaryBackgroundBrush": "#66E6E9EF",
      "CmdPal.CommandBarBorderBrush": "#DCE0E8",
      "CmdPal.TopBarBorderBrush": "#DCE0E8",
      "CmdPal.DividerStrokeColorDefaultBrush": "#BCC0CC",
      "CmdPal.SearchBoxBackground": "#E6E9EF",
      "CmdPal.SearchBoxForeground": "#4C4F69",
      "CmdPal.SearchBoxPlaceholderForeground": "#6C6F85",
      "CmdPal.SearchBoxBorderBrush": "#DCE0E8",
      "CmdPal.ListItemBackground": "Transparent",
      "CmdPal.ListItemBackgroundPointerOver": "#10585B70",
      "CmdPal.ListItemBackgroundSelected": "#20585B70",
      "CmdPal.ListItemForeground": "#4C4F69",
      "CmdPal.ListItemForegroundSecondary": "#6C6F85",
      "CmdPal.ButtonBackground": "#E6E9EF",
      "CmdPal.ButtonForeground": "#4C4F69",
      "CmdPal.ButtonBackgroundPointerOver": "#DCE0E8",
      "CmdPal.ButtonBorderBrush": "#DCE0E8",
      "CmdPal.AccentColor": "#8839EF",
      "CmdPal.TagBackground": "#E6E9EF",
      "CmdPal.TagForeground": "#8839EF",
      "CmdPal.TagBorderBrush": "#DCE0E8",
      "CmdPal.ContextMenuBackground": "#EFF1F5",
      "CmdPal.ContextMenuBorderBrush": "#DCE0E8",
      "CmdPal.ContextMenuItemBackgroundPointerOver": "#E6E9EF",
      "CmdPal.ContextMenuForeground": "#4C4F69",
      "Dock.ItemBackground": "Transparent",
      "Dock.ItemBackgroundPointerOver": "#10585B70",
      "Dock.ItemBackgroundPressed": "#08585B70",
      "Dock.ItemBorderBrush": "Transparent",
      "Dock.ItemBorderBrushPointerOver": "#DCE0E8",
      "Dock.ItemForeground": "#4C4F69",
      "Dock.ItemForegroundSecondary": "#6C6F85"
    }
  },
  "backdrop": {
    "style": "Acrylic",
    "tintOpacity": 0.9,
    "luminosityOpacity": 0.85
  }
}
