{
  "version": 1,
  "name": "One Dark",
  "author": "PowerToys",
  "description": "Atom's iconic dark theme adapted for CmdPal",
  "fonts": {
    "primary": { "family": "Verdana", "size": 13, "weight": "Normal" },
    "monospace": { "family": "Consolas", "size": 13, "weight": "Normal" },
    "title": { "family": "Verdana", "size": 15, "weight": "Bold" },
    "caption": { "family": "Verdana", "size": 11, "weight": "Normal" }
  },
  "resources": {
    "dark": {
      "LayerOnAcrylicPrimaryBackgroundBrush": "#80282C34",
      "LayerOnAcrylicSecondaryBackgroundBrush": "Transparent",
      "CmdPal.CommandBarBorderBrush": "#21252B",
      "CmdPal.TopBarBorderBrush": "#21252B",
      "CmdPal.DividerStrokeColorDefaultBrush": "#3E4451",
      "CmdPal.SearchBoxBackground": "#21252B",
      "CmdPal.SearchBoxForeground": "#ABB2BF",
      "CmdPal.SearchBoxPlaceholderForeground": "#5C6370",
      "CmdPal.SearchBoxBorderBrush": "#3E4451",
      "CmdPal.ListItemBackground": "Transparent",
      "CmdPal.ListItemBackgroundPointerOver": "#3021252B",
      "CmdPal.ListItemBackgroundSelected": "#5021252B",
      "CmdPal.ListItemForeground": "#ABB2BF",
      "CmdPal.ListItemForegroundSecondary": "#5C6370",
      "CmdPal.ButtonBackground": "#21252B",
      "CmdPal.ButtonForeground": "#ABB2BF",
      "CmdPal.ButtonBackgroundPointerOver": "#3E4451",
      "CmdPal.ButtonBorderBrush": "#3E4451",
      "CmdPal.AccentColor": "#61AFEF",
      "CmdPal.TagBackground": "#21252B",
      "CmdPal.TagForeground": "#C678DD",
      "CmdPal.TagBorderBrush": "#3E4451",
      "CmdPal.ContextMenuBackground": "#282C34",
      "CmdPal.ContextMenuBorderBrush": "#21252B",
      "CmdPal.ContextMenuItemBackgroundPointerOver": "#21252B",
      "CmdPal.ContextMenuForeground": "#ABB2BF",
      "Dock.ItemBackground": "Transparent",
      "Dock.ItemBackgroundPointerOver": "#3021252B",
      "Dock.ItemBackgroundPressed": "#2021252B",
      "Dock.ItemBorderBrush": "Transparent",
      "Dock.ItemBorderBrushPointerOver": "#3E4451",
      "Dock.ItemForeground": "#ABB2BF",
      "Dock.ItemForegroundSecondary": "#5C6370"
    },
    "light": {
      "LayerOnAcrylicPrimaryBackgroundBrush": "#A0FAFAFA",
      "LayerOnAcrylicSecondaryBackgroundBrush": "#66F0F0F0",
      "CmdPal.CommandBarBorderBrush": "#DBDBDC",
      "CmdPal.TopBarBorderBrush": "#DBDBDC",
      "CmdPal.DividerStrokeColorDefaultBrush": "#A0A1A7",
      "CmdPal.SearchBoxBackground": "#F0F0F0",
      "CmdPal.SearchBoxForeground": "#383A42",
      "CmdPal.SearchBoxPlaceholderForeground": "#A0A1A7",
      "CmdPal.SearchBoxBorderBrush": "#DBDBDC",
      "CmdPal.ListItemBackground": "Transparent",
      "CmdPal.ListItemBackgroundPointerOver": "#10383A42",
      "CmdPal.ListItemBackgroundSelected": "#20383A42",
      "CmdPal.ListItemForeground": "#383A42",
      "CmdPal.ListItemForegroundSecondary": "#A0A1A7",
      "CmdPal.ButtonBackground": "#F0F0F0",
      "CmdPal.ButtonForeground": "#383A42",
      "CmdPal.ButtonBackgroundPointerOver": "#E5E5E6",
      "CmdPal.ButtonBorderBrush": "#DBDBDC",
      "CmdPal.AccentColor": "#4078F2",
      "CmdPal.TagBackground": "#F0F0F0",
      "CmdPal.TagForeground": "#A626A4",
      "CmdPal.TagBorderBrush": "#DBDBDC",
      "CmdPal.ContextMenuBackground": "#FAFAFA",
      "CmdPal.ContextMenuBorderBrush": "#DBDBDC",
      "CmdPal.ContextMenuItemBackgroundPointerOver": "#F0F0F0",
      "CmdPal.ContextMenuForeground": "#383A42",
      "Dock.ItemBackground": "Transparent",
      "Dock.ItemBackgroundPointerOver": "#10383A42",
      "Dock.ItemBackgroundPressed": "#08383A42",
      "Dock.ItemBorderBrush": "Transparent",
      "Dock.ItemBorderBrushPointerOver": "#DBDBDC",
      "Dock.ItemForeground": "#383A42",
      "Dock.ItemForegroundSecondary": "#A0A1A7"
    }
  },
  "backdrop": {
    "style": "Acrylic",
    "tintOpacity": 0.9,
    "luminosityOpacity": 0.85
  }
}
