{
  "version": 1,
  "name": "GitHub Dark",
  "author": "PowerToys",
  "description": "GitHub's official dark theme colors",
  "fonts": {
    "primary": { "family": "Segoe UI Variable", "size": 14, "weight": "Medium" },
    "monospace": { "family": "Cascadia Mono", "size": 13, "weight": "Normal" },
    "title": { "family": "Segoe UI Variable", "size": 16, "weight": "Bold" },
    "caption": { "family": "Segoe UI Variable", "size": 12, "weight": "Light" }
  },
  "resources": {
    "dark": {
      "LayerOnAcrylicPrimaryBackgroundBrush": "#800D1117",
      "LayerOnAcrylicSecondaryBackgroundBrush": "Transparent",
      "CmdPal.CommandBarBorderBrush": "#21262D",
      "CmdPal.TopBarBorderBrush": "#21262D",
      "CmdPal.DividerStrokeColorDefaultBrush": "#30363D",
      "CmdPal.SearchBoxBackground": "#161B22",
      "CmdPal.SearchBoxForeground": "#C9D1D9",
      "CmdPal.SearchBoxPlaceholderForeground": "#8B949E",
      "CmdPal.SearchBoxBorderBrush": "#30363D",
      "CmdPal.ListItemBackground": "Transparent",
      "CmdPal.ListItemBackgroundPointerOver": "#30161B22",
      "CmdPal.ListItemBackgroundSelected": "#50161B22",
      "CmdPal.ListItemForeground": "#C9D1D9",
      "CmdPal.ListItemForegroundSecondary": "#8B949E",
      "CmdPal.ButtonBackground": "#21262D",
      "CmdPal.ButtonForeground": "#C9D1D9",
      "CmdPal.ButtonBackgroundPointerOver": "#30363D",
      "CmdPal.ButtonBorderBrush": "#30363D",
      "CmdPal.AccentColor": "#58A6FF",
      "CmdPal.TagBackground": "#21262D",
      "CmdPal.TagForeground": "#58A6FF",
      "CmdPal.TagBorderBrush": "#30363D",
      "CmdPal.ContextMenuBackground": "#0D1117",
      "CmdPal.ContextMenuBorderBrush": "#21262D",
      "CmdPal.ContextMenuItemBackgroundPointerOver": "#161B22",
      "CmdPal.ContextMenuForeground": "#C9D1D9",
      "Dock.ItemBackground": "Transparent",
      "Dock.ItemBackgroundPointerOver": "#30161B22",
      "Dock.ItemBackgroundPressed": "#20161B22",
      "Dock.ItemBorderBrush": "Transparent",
      "Dock.ItemBorderBrushPointerOver": "#30363D",
      "Dock.ItemForeground": "#C9D1D9",
      "Dock.ItemForegroundSecondary": "#8B949E"
    },
    "light": {
      "LayerOnAcrylicPrimaryBackgroundBrush": "#A0FFFFFF",
      "LayerOnAcrylicSecondaryBackgroundBrush": "#66F6F8FA",
      "CmdPal.CommandBarBorderBrush": "#D0D7DE",
      "CmdPal.TopBarBorderBrush": "#D0D7DE",
      "CmdPal.DividerStrokeColorDefaultBrush": "#D8DEE4",
      "CmdPal.SearchBoxBackground": "#F6F8FA",
      "CmdPal.SearchBoxForeground": "#24292F",
      "CmdPal.SearchBoxPlaceholderForeground": "#57606A",
      "CmdPal.SearchBoxBorderBrush": "#D0D7DE",
      "CmdPal.ListItemBackground": "Transparent",
      "CmdPal.ListItemBackgroundPointerOver": "#1024292F",
      "CmdPal.ListItemBackgroundSelected": "#2024292F",
      "CmdPal.ListItemForeground": "#24292F",
      "CmdPal.ListItemForegroundSecondary": "#57606A",
      "CmdPal.ButtonBackground": "#F6F8FA",
      "CmdPal.ButtonForeground": "#24292F",
      "CmdPal.ButtonBackgroundPointerOver": "#E1E4E8",
      "CmdPal.ButtonBorderBrush": "#D0D7DE",
      "CmdPal.AccentColor": "#0969DA",
      "CmdPal.TagBackground": "#F6F8FA",
      "CmdPal.TagForeground": "#0969DA",
      "CmdPal.TagBorderBrush": "#D0D7DE",
      "CmdPal.ContextMenuBackground": "#FFFFFF",
      "CmdPal.ContextMenuBorderBrush": "#D0D7DE",
      "CmdPal.ContextMenuItemBackgroundPointerOver": "#F6F8FA",
      "CmdPal.ContextMenuForeground": "#24292F",
      "Dock.ItemBackground": "Transparent",
      "Dock.ItemBackgroundPointerOver": "#1024292F",
      "Dock.ItemBackgroundPressed": "#0824292F",
      "Dock.ItemBorderBrush": "Transparent",
      "Dock.ItemBorderBrushPointerOver": "#D0D7DE",
      "Dock.ItemForeground": "#24292F",
      "Dock.ItemForegroundSecondary": "#57606A"
    }
  },
  "backdrop": {
    "style": "Acrylic",
    "tintOpacity": 0.9,
    "luminosityOpacity": 0.85
  }
}
