{
  "version": 1,
  "name": "Tokyo Night",
  "author": "PowerToys",
  "description": "A clean dark theme inspired by Tokyo city lights",
  "fonts": {
    "primary": { "family": "Consolas", "size": 14, "weight": "Normal" },
    "monospace": { "family": "Consolas", "size": 13, "weight": "Normal" },
    "title": { "family": "Consolas", "size": 16, "weight": "Bold" },
    "caption": { "family": "Consolas", "size": 11, "weight": "Normal" }
  },
  "resources": {
    "dark": {
      "LayerOnAcrylicPrimaryBackgroundBrush": "#801A1B26",
      "LayerOnAcrylicSecondaryBackgroundBrush": "Transparent",
      "CmdPal.CommandBarBorderBrush": "#24283B",
      "CmdPal.TopBarBorderBrush": "#24283B",
      "CmdPal.DividerStrokeColorDefaultBrush": "#3B4261",
      "CmdPal.SearchBoxBackground": "#24283B",
      "CmdPal.SearchBoxForeground": "#C0CAF5",
      "CmdPal.SearchBoxPlaceholderForeground": "#565F89",
      "CmdPal.SearchBoxBorderBrush": "#3B4261",
      "CmdPal.ListItemBackground": "Transparent",
      "CmdPal.ListItemBackgroundPointerOver": "#3024283B",
      "CmdPal.ListItemBackgroundSelected": "#5024283B",
      "CmdPal.ListItemForeground": "#C0CAF5",
      "CmdPal.ListItemForegroundSecondary": "#565F89",
      "CmdPal.ButtonBackground": "#24283B",
      "CmdPal.ButtonForeground": "#C0CAF5",
      "CmdPal.ButtonBackgroundPointerOver": "#3B4261",
      "CmdPal.ButtonBorderBrush": "#3B4261",
      "CmdPal.AccentColor": "#7AA2F7",
      "CmdPal.TagBackground": "#24283B",
      "CmdPal.TagForeground": "#BB9AF7",
      "CmdPal.TagBorderBrush": "#3B4261",
      "CmdPal.ContextMenuBackground": "#1A1B26",
      "CmdPal.ContextMenuBorderBrush": "#24283B",
      "CmdPal.ContextMenuItemBackgroundPointerOver": "#24283B",
      "CmdPal.ContextMenuForeground": "#C0CAF5",
      "Dock.ItemBackground": "Transparent",
      "Dock.ItemBackgroundPointerOver": "#3024283B",
      "Dock.ItemBackgroundPressed": "#2024283B",
      "Dock.ItemBorderBrush": "Transparent",
      "Dock.ItemBorderBrushPointerOver": "#3B4261",
      "Dock.ItemForeground": "#C0CAF5",
      "Dock.ItemForegroundSecondary": "#565F89"
    },
    "light": {
      "LayerOnAcrylicPrimaryBackgroundBrush": "#A0D5D6DB",
      "LayerOnAcrylicSecondaryBackgroundBrush": "#66E1E2E7",
      "CmdPal.CommandBarBorderBrush": "#C0C1CC",
      "CmdPal.TopBarBorderBrush": "#C0C1CC",
      "CmdPal.DividerStrokeColorDefaultBrush": "#9699A3",
      "CmdPal.SearchBoxBackground": "#E1E2E7",
      "CmdPal.SearchBoxForeground": "#343B59",
      "CmdPal.SearchBoxPlaceholderForeground": "#6172AF",
      "CmdPal.SearchBoxBorderBrush": "#C0C1CC",
      "CmdPal.ListItemBackground": "Transparent",
      "CmdPal.ListItemBackgroundPointerOver": "#10343B59",
      "CmdPal.ListItemBackgroundSelected": "#20343B59",
      "CmdPal.ListItemForeground": "#343B59",
      "CmdPal.ListItemForegroundSecondary": "#6172AF",
      "CmdPal.ButtonBackground": "#E1E2E7",
      "CmdPal.ButtonForeground": "#343B59",
      "CmdPal.ButtonBackgroundPointerOver": "#D5D6DB",
      "CmdPal.ButtonBorderBrush": "#C0C1CC",
      "CmdPal.AccentColor": "#2E7DE9",
      "CmdPal.TagBackground": "#E1E2E7",
      "CmdPal.TagForeground": "#7847BD",
      "CmdPal.TagBorderBrush": "#C0C1CC",
      "CmdPal.ContextMenuBackground": "#D5D6DB",
      "CmdPal.ContextMenuBorderBrush": "#C0C1CC",
      "CmdPal.ContextMenuItemBackgroundPointerOver": "#E1E2E7",
      "CmdPal.ContextMenuForeground": "#343B59",
      "Dock.ItemBackground": "Transparent",
      "Dock.ItemBackgroundPointerOver": "#10343B59",
      "Dock.ItemBackgroundPressed": "#08343B59",
      "Dock.ItemBorderBrush": "Transparent",
      "Dock.ItemBorderBrushPointerOver": "#C0C1CC",
      "Dock.ItemForeground": "#343B59",
      "Dock.ItemForegroundSecondary": "#6172AF"
    }
  },
  "backdrop": {
    "style": "Acrylic",
    "tintOpacity": 0.9,
    "luminosityOpacity": 0.85
  }
}
